{
  "$schema": "https://json-schema.org/draft/2020-12/schema",
  "$id": "https://orbi.local/schemas/orbi-agent-observation-v1.schema.json",
  "title": "ORBI Agent Observation v1",
  "type": "object",
  "additionalProperties": false,
  "required": [
    "schemaVersion",
    "status",
    "summary",
    "nextActions",
    "artifacts",
    "evidence",
    "authorityImpact"
  ],
  "properties": {
    "schemaVersion": {
      "const": "orbi.agent.observation.v1"
    },
    "status": {
      "enum": [
        "success",
        "warning",
        "error"
      ]
    },
    "summary": {
      "type": "string",
      "minLength": 1,
      "maxLength": 1000
    },
    "nextActions": {
      "type": "array",
      "items": {
        "type": "string",
        "minLength": 1
      },
      "maxItems": 20
    },
    "artifacts": {
      "type": "array",
      "items": {
        "type": "string",
        "minLength": 1
      },
      "maxItems": 50
    },
    "evidence": {
      "type": "array",
      "maxItems": 50,
      "items": {
        "type": "object",
        "additionalProperties": false,
        "required": [
          "kind",
          "reference",
          "verification"
        ],
        "properties": {
          "kind": {
            "enum": [
              "git",
              "test",
              "ci",
              "file",
              "artifact",
              "runtime",
              "external"
            ]
          },
          "reference": {
            "type": "string",
            "minLength": 1
          },
          "verification": {
            "enum": [
              "verified",
              "observed",
              "unverified"
            ]
          }
        }
      }
    },
    "authorityImpact": {
      "type": "object",
      "additionalProperties": {
        "type": "boolean"
      },
      "minProperties": 1
    },
    "humanApprovalRequired": {
      "type": "boolean"
    },
    "localEvidenceRequired": {
      "type": "boolean"
    },
    "recovery": {
      "type": "object",
      "additionalProperties": false,
      "required": [
        "rootCauseHint",
        "safeRetry",
        "stopCondition"
      ],
      "properties": {
        "rootCauseHint": {
          "type": "string",
          "minLength": 1
        },
        "safeRetry": {
          "type": "string",
          "minLength": 1
        },
        "stopCondition": {
          "type": "string",
          "minLength": 1
        }
      }
    }
  },
  "allOf": [
    {
      "if": {
        "properties": {
          "status": {
            "const": "error"
          }
        },
        "required": [
          "status"
        ]
      },
      "then": {
        "required": [
          "recovery"
        ]
      }
    }
  ]
}
